id,importe,tipo,descripcion,animal_id,inserted_at,updated_at
587f9bea-e302-4c5a-b25d-6d92388ccd3c,35,"Oth traum displ spondylolysis of 2nd cervcal vert, 7thK","Replacement of Nasal Bone with Synth Sub, Open Approach",9cf16edd-8316-4800-9fbc-d6f4ccc99361,2022-09-25 10:11:42,2022-04-20 13:44:15
e7e95424-0b0f-4fb8-8233-dd2317fee085,55,"Major laceration of inferior vena cava, subsequent encounter","Removal of Infusion Device from Right Eye, Perc Approach",f0fa8ff9-e7c8-45a3-85e0-356c9fb45ff4,2022-11-04 22:11:12,2022-07-12 00:24:38
6f236151-6aa3-4789-89f3-1259ae021d27,66,Enlargement of unspecified orbit,"Extirpate matter from Papillary Muscle, Perc Endo",f0fa8ff9-e7c8-45a3-85e0-356c9fb45ff4,2022-07-27 18:19:03,2023-01-13 22:43:58
0d3d5cca-4912-4b15-92b5-7f7db543f130,34,"Traum hemor right cerebrum w LOC of 6-24 hrs, init","Occlusion of R Femor Vein with Intralum Dev, Perc Approach",4f9fcd33-4fd7-4846-85ae-3096bc137282,2022-10-31 09:34:05,2022-12-29 01:32:53
2520ecb1-5f14-48e4-bd0e-79c68d0aea39,40,"Other spondylosis with myelopathy, cervical region","Drainage of Left Trunk Muscle with Drain Dev, Perc Approach",658dbbd0-f07a-4a71-ba2a-c4b4c77e3fa6,2022-08-30 14:28:45,2022-04-11 12:14:48
c1834321-bd43-4544-8212-27ec3dab6465,95,"Displ bicondylar fx l tibia, 7thQ",Motor Speech Treatment using Biosensory Feedback Equipment,afde3172-a17d-4a05-befb-f1a2b9997a9b,2022-10-08 19:17:38,2022-03-23 11:08:08
da462326-89e7-4c45-a585-75f1bc9265f7,89,Corrosion of second degree of abdominal wall,"Restrict of R Cephalic Vein with Intralum Dev, Open Approach",29b6b6d2-8bbc-4f85-988d-6eb81c771181,2022-12-02 05:32:46,2022-11-13 00:49:37
e074528c-f77a-4229-aded-88e23e454c7e,96,Unsp war operations occurring after cessation of hostilities,LDR Brachytherapy of Pelvic Region using Oth Isotope,bfe82cbf-a7b3-48ff-9634-080ab11b4fc0,2022-10-09 13:04:57,2023-01-24 01:38:54
57a62d76-c851-4112-b2f2-3cb5b01e9a72,72,"Tidal wave due to storm, subsequent encounter","Drainage of Left Wrist Joint, Perc Endo Approach, Diagn",4ae66f99-2d0a-429c-a1c7-53beb81fd979,2022-12-31 21:04:14,2022-03-10 03:20:20
3935805d-9e65-4768-8f31-89f32ea8c206,20,"Displ trimalleol fx l low leg, 7thR","Restriction of Left Vertebral Vein, Open Approach",4139221b-c7c8-467e-ab37-b6c93b365c4c,2022-05-20 10:58:04,2023-01-22 14:31:20
1f651f38-69f5-4b3c-b0c6-eef874527743,85,Gestational diabetes mellitus,"Dilation of Mitral Valve with Drug-elut Intra, Perc Approach",49b08d33-8f6a-4abd-b41c-01ec3a4fe507,2022-04-16 02:05:51,2022-05-06 04:12:29
ff400150-8ccc-4ef4-9e4b-84bfaf3af190,72,"Algoneurodystrophy, lower leg","Dilation of Ileum, Percutaneous Endoscopic Approach",6be70906-295a-41ac-857c-20d2a7d2ed02,2022-06-25 21:06:23,2023-01-13 16:05:55
7d91135e-90e4-4db4-8c02-9ed327aa6fa0,75,"Other cyst of bone, left thigh","Supplement R Low Leg with Nonaut Sub, Perc Endo Approach",fff1d99e-7936-4cc9-976d-e1449e08e4f6,2022-03-21 13:09:15,2022-12-22 02:03:39
a6aa39c3-fc00-43f2-b593-17b2f6daee21,85,"Nondisp seg fx shaft of r fibula, 7thK","Bypass 1 Cor Art from R Int Mammary w Autol Vn, Perc Endo",3f1e56ac-ab9a-4185-8c91-373f40acc392,2022-07-02 23:57:30,2022-05-14 19:52:41
846eab0b-1c88-4c08-8479-c91ae795f9a6,63,"Hypothermia following anesthesia, sequela","Release Right External Ear, External Approach",d9392a30-607e-47a7-9f1d-08395467f408,2022-12-04 01:01:56,2022-09-20 06:34:57
22b4de5f-479a-49b3-8ac7-99ce49b9107e,4,"Other infective bursitis, left hip","Transfer R Low Arm Subcu/Fascia w Skin, Subcu, Fascia, Open",d4c05dd6-f96c-469a-97c8-f001d62f22e6,2022-03-25 07:12:30,2023-02-02 18:21:11
b84ab2ac-2723-425a-98c2-d15409385311,7,"Oth fracture of unsp thor vertebra, subs for fx w routn heal","Drainage of Left External Auditory Canal, Via Opening",97c9971c-f99c-4788-b2e0-1bde75c87d5a,2022-11-30 16:44:15,2023-02-23 05:42:07
218f050c-b615-4015-b5a7-f51ee8fd135f,91,Unspecified injury of external jugular vein,"Extirpate of Matter from R Int Iliac Art, Perc Endo Approach",e42ba0fc-b4f8-434a-8772-34610d7520ed,2022-12-19 06:27:18,2022-07-26 01:06:14
f2413b9f-b690-4737-a8d2-8623c3af4f43,22,"Poisoning by intravenous anesthetics, assault, sequela","Occlusion of Right Axillary Artery, Open Approach",96dd1402-3684-481e-9393-09fca85e2505,2022-06-01 20:44:20,2022-08-24 01:17:17
8b80c0f0-02e1-48d5-a1cb-bbb074c5369e,7,"Laceration w fb of unsp cheek and TMJ area, sequela","Supplement L Wrist Bursa/Lig with Synth Sub, Open Approach",5ef59eb7-78e0-4aaa-a148-1e4617358043,2022-10-10 08:54:30,2022-08-30 15:19:28
c1485181-fb61-4ca0-ae6e-491e7e819d74,96,"Poisoning by coronary vasodilators, accidental, init","Revise Autol Sub in Low Extrem Subcu/Fascia, Open",eea03a79-588e-4b0f-b266-b57f75f6cdea,2022-09-04 02:32:03,2022-10-13 11:46:04
2de328c6-b022-470f-8462-831804b99a23,68,"Unspecified injury of esophagus (thoracic part), subs encntr","Dilate R Popl Art, Bifurc, w Intralum Dev, Perc Endo",0238e6c4-5cbb-4563-9a39-15fb8070d78a,2022-03-18 03:52:17,2022-09-12 05:00:37
9e7bfdb5-6d43-4018-9a5f-682c8d42eb38,57,"Oth physl fx upper end of unsp tibia, subs for fx w malunion","Removal of Nonaut Sub from R Hip Jt, Open Approach",fe7a668a-8602-44c3-8ff8-b18b5d7f1f92,2023-02-05 18:35:00,2022-12-09 19:44:15
baabb190-8d7b-4e34-8539-4853e9609c93,40,"Unsp superficial injury of right middle finger, sequela","Reposition Right Metacarpophalangeal Joint, Perc Approach",a1bf7bd0-7bfa-4356-9a19-d6cce274143d,2022-08-21 11:00:54,2022-06-21 03:35:08
3d82fef9-6802-4a8a-b28a-dc190de3e2bd,19,"Inj l int crtd, intcr w LOC w death d/t brain inj bf consc","Insert of Cardiac Lead into L Ventricle, Perc Endo Approach",a5a62144-1554-42a5-a9f7-9579dfab742a,2022-05-22 01:21:26,2022-06-14 23:59:22
834c1aa5-789f-4c93-9cd6-216dc89677cc,23,Cyst of unspecified orbit,"Monitoring of Venous Flow, Central, Percutaneous Approach",7ab6de97-5b7d-4892-b75d-f4c0295b4e19,2023-01-12 17:18:52,2023-02-10 15:56:06
52e6a030-1f07-41da-bb52-a4b182c00683,31,Deficiency of multiple nutrient elements,"Restriction of Hepatic Art with Extralum Dev, Perc Approach",239a675e-109e-4901-81a1-156e9563a1f2,2023-01-08 00:33:45,2022-07-10 10:35:59
eaf518e8-9976-4f83-8908-c6641aba8eff,59,"Traum hemor left cerebrum w LOC of 31-59 min, init","Supplement Right Carpal Joint with Nonaut Sub, Perc Approach",bd19f0cc-71ea-490d-af62-83b381989aeb,2022-03-02 00:48:32,2022-10-25 10:43:26
c41d2972-bf4b-4988-8ec8-cac3ac3ad864,2,"Displ spiral fx shaft of ulna, r arm, 7thN","Dilation of Left Anterior Tibial Artery, Perc Endo Approach",f92aba53-eb8f-4cd7-8c7a-94cb8247be7b,2022-08-24 04:04:49,2022-08-05 09:16:41
1a400f5e-146e-4bb5-96e2-efc702a04e3d,9,"Chorioamnionitis, third trimester, fetus 2","Reposition Stomach, Endo",a1a990cc-5a9a-49c7-a219-61e4d62e104f,2022-06-04 19:18:19,2022-12-05 08:34:17
21844287-b41a-4769-8468-ebef23acc9a9,48,"Unspecified pre-eclampsia, complicating the puerperium","Drainage of Sacral Plexus, Percutaneous Endoscopic Approach",d01672c4-03af-4aab-8707-fb22fd07fd98,2022-06-08 00:08:11,2022-07-08 09:14:31
9bced0c7-31d6-41aa-bcd4-2a715ba2dcd5,94,"Nondisp fx of shaft of left clavicle, subs for fx w malunion","Removal of Drainage Device from Thor Jt, Extern Approach",35a8042b-1e9d-4d79-a8ee-edf075e63da2,2022-03-06 16:56:01,2022-06-01 02:37:08
0e5e0508-c2d1-45b4-8eb0-bf1d18ada221,66,"Oth deforming dorsopathies, occipito-atlanto-axial region","Revision of Synth Sub in L Metacarpophal Jt, Perc Approach",7875a733-307e-4e34-a629-72a34fd12f8d,2022-10-02 17:03:01,2022-12-09 05:25:26
eb83e339-53de-4a5d-9a14-11a290f5d975,99,"Oth diab with mild nonp rtnop without macular edema, l eye","Bypass Duodenum to Jejunum w Synth Sub, Perc Endo",37b8d209-3254-4cc0-a413-f3f630334775,2022-09-21 00:31:12,2022-07-11 10:57:41
09b6b772-6658-4728-a64f-99dbfdeb30ed,10,Other acute skin changes due to ultraviolet radiation,"Bypass L Subclav Art to L Low Arm Art w Autol Art, Open",16b079cd-0eb6-422f-b4b2-7c84c45a5153,2022-10-13 16:09:50,2022-06-20 06:24:15
758a37f2-bfe9-459b-ac3f-452a9981b971,87,Other specified injury of dorsal artery of foot,"Revision of Synth Sub in R Pleural Cav, Extern Approach",e01fb763-d1e1-493a-886c-10a4a53e8cb9,2022-05-21 03:51:46,2022-03-14 02:37:38
1e405baa-4f49-43f3-a7ac-d70a7ec7e849,6,"Pathological fracture, right foot, subs for fx w nonunion","Insert Diaphragm Lead in L Diaphragm, Perc Endo",303b77b1-ffbf-4482-beba-ddef3c6430fc,2022-04-08 07:50:12,2022-06-24 05:22:42
ea990996-a867-4be8-b2ed-84ef6fdd807c,71,"Unsp injury of radial artery at forearm level, unsp arm","Dilation of L Subclav Art with Intralum Dev, Perc Approach",69c6f5ec-0929-48e0-80b3-ceb4233b7f6c,2022-10-11 10:49:21,2022-05-22 13:53:36
d36ebce9-7124-43a4-953b-82a15cf77a55,44,"Disp fx of med malleolus of r tibia, 7thJ",Compression of Right Hand using Intermittent Pressure Device,60350bae-c94c-4f07-84c0-dd3c4525e003,2022-06-09 05:38:49,2023-01-26 07:12:36
e416702b-f058-4c06-b726-6c711cb907d3,63,"Poisoning by immunoglobulin, undetermined, initial encounter","Release Bilateral Breast, External Approach",a1be5fb6-e967-4ac1-8a01-7c10cedd525c,2022-12-11 03:04:12,2022-08-10 07:13:47
e22be609-f44a-4c52-9beb-5331b3dcc78c,40,"Familial chondrocalcinosis, right knee","Revision of Spacer in T-lum Jt, Open Approach",3e01c66e-a603-4b1d-93a7-f574a52e6ff1,2022-09-04 12:05:01,2022-12-07 19:07:26
f42cf496-8c22-4f72-bc1f-ece27cb98596,22,"Other fracture of occiput, right side",Beam Radiation of Kidney using Neutron Capture,0c0acfba-44d7-4b9c-94bb-47676da0477c,2022-09-05 10:55:13,2022-07-27 21:31:30
08c992fd-6c11-4f8d-b72a-da46c3dad34b,39,Infect/inflm reaction due to internal left knee prosthesis,"Repair Urinary System in POC with Oth Dev, Perc Approach",59e421db-f1c8-4fd7-a2a8-687648af0b3f,2022-11-02 15:44:49,2022-06-25 04:02:04
24f539f7-045e-48ef-a128-8d2f5482c0d8,21,"Stiffness of unspecified foot, not elsewhere classified",Change Intermittent Pressure Device on Left Upper Extremity,fde9117c-0769-4de8-aaa7-6c7d4e221d68,2022-10-16 02:37:29,2022-07-13 02:31:30
59450df3-7a4e-4664-9314-899961ea56ff,17,"Dislocation of T6/T7 thoracic vertebra, initial encounter","Excision of Lingula Bronchus, Perc Endo Approach",07298433-96fb-4551-8f9a-da1f5b3eba4e,2023-01-12 23:36:11,2022-10-30 16:32:49
c4c5d905-b60c-477f-8f0f-07f79d5e183b,12,Jumping or diving from boat striking bottom causing drown,"Excision of Left Knee Bursa and Ligament, Open Approach",9f45270c-1e5d-4a68-b083-7bbddf1625c6,2022-09-06 20:49:59,2023-02-19 15:18:26
e70748ed-fea0-45e4-88dd-0e9668b172b4,4,"Greenstick fx shaft of right ulna, subs for fx w routn heal","Extirpate matter from L Ext Iliac Art, Bifurc, Perc",55059863-09a7-4ac0-a34d-ee1b86f4bedd,2022-08-18 22:39:52,2022-06-03 18:37:45
4e2dfcf0-7f4e-42ee-985d-d02501e22a7f,74,"Displ avuls fx (chip fracture) of l talus, 7thG","Fusion of L Metatarsotars Jt with Int Fix, Open Approach",89b91b02-6635-41cb-b8a3-1fd0f9e3ea8c,2022-03-05 06:57:35,2022-07-26 09:31:47
3b5146a0-df26-447a-a130-c1fb040ce797,76,"Fall into oth water striking bottom causing drown, subs","Extirpate matter from R Post Tib Art, Bifurc, Open",750cfbd6-136f-461c-9a8b-4056af75a5e7,2022-05-23 09:25:14,2022-09-06 23:57:23
421f8d19-7ed2-452b-a474-e7601964d217,90,"Poisoning by oth systemic antibiotics, intentional self-harm",Fluoroscopy of Oth Intraabd Art using L Osm Contrast,2b5ddeee-8f52-4876-95cf-73c6d01d9c69,2022-11-22 14:16:59,2022-12-14 07:49:04
e5420a53-2847-4843-98c7-68c74819bca4,42,Bus occupant (driver) injured in oth transport accidents,"Destruction of Left Vitreous, Percutaneous Approach",f7f4db09-5238-4dc3-8e16-7a11e271e593,2022-12-15 16:21:05,2023-01-07 15:48:51
bdb4ef2e-8f29-4a3c-8585-74699302953c,35,"Osteochondropathy, unspecified, right thigh","Drainage of Cervical Vertebra, Open Approach, Diagnostic",376f885a-f67c-46fd-85d2-41942c6f0792,2022-04-14 15:49:31,2023-01-20 14:31:42
273bdb95-0022-4f3b-9146-0cf3ad50f53c,83,Other spondylopathies,"Bypass Ileum to Anus, Open Approach",8ea39819-b259-438c-a86f-38bf678cb764,2022-03-13 03:26:54,2023-01-18 13:40:24
62d19dba-3ee5-4450-9d72-27f79d09abec,44,Partial traumatic amputation of great toe,"Bypass R Less Saphenous to Low Vein w Autol Art, Open",11c5babe-f422-435a-b848-972fa767895c,2022-11-11 16:31:37,2022-04-23 08:25:43
aaeba758-9812-436b-984b-531666822071,17,"Displ seg fx shaft of unsp fibula, 7thD",Magnetic Resonance Imaging (MRI) of Head using Oth Contrast,7db2269f-31fd-413c-ae1d-745f57330426,2022-08-16 10:12:48,2023-02-11 04:49:34
1ca62964-b4c6-494e-9384-058b47d16a1b,80,"Strain flxr musc/fasc/tend r little fngr at wrs/hnd lv, sqla",Magnetic Resonance Imaging (MRI) of Left Breast,8d0664cf-051d-446e-91d4-68622bbfb508,2022-08-23 00:58:07,2022-07-10 20:19:20
c074a3cf-a264-4cb8-bfcc-edfcd85639b8,11,Street and highway as place,"Supplement R Glenoid Cav with Autol Sub, Perc Approach",efe8f7fd-e426-4458-ad9e-bce2313077f4,2022-11-02 08:37:09,2022-08-01 11:11:49
aa2f3182-882b-4145-ad39-8d9ad9ae1cc8,72,"Poisoning by antithrombotic drugs, assault",Plain Radiography of Bi Fallop Tube using H Osm Contrast,7c0d626a-6a7d-4a8c-8c3d-92d138dc717a,2022-04-16 10:32:43,2023-02-01 11:42:15
2f728dd0-19df-42e5-9ce8-7f3ea1439297,99,"Corrosion of first degree of left elbow, sequela","Excision of Coccyx, Percutaneous Endoscopic Approach, Diagn",83a06f38-4dcc-47c1-b461-2583946fa686,2022-05-10 21:15:41,2022-06-14 13:17:59
223093a9-6a3d-4461-8103-5c3857877679,31,"Poisoning by alpha-adrenocpt antagonists, accidental, init","Removal of Ext Fix from R Low Femur, Perc Approach",eec7811e-4abd-483a-b40b-08ff87105a19,2022-12-23 09:22:55,2023-01-07 01:11:39
6d24a76d-bbd3-4a6f-9263-94d8d583828b,53,"Oth unil sec osteoarth of first carpometacarp joint, l hand","Supplement R Abd Muscle with Synth Sub, Perc Endo Approach",9fad9dc9-22e3-443b-b1ed-65ea419b4ea1,2022-09-12 18:07:15,2022-07-19 08:31:56
7c485632-fbb4-4145-969f-57b1e8d53baf,83,"Insect bite (nonvenomous) of unspecified wrist, subs encntr","Revision of Extralum Dev in Tracheobronc Tree, Open Approach",461f9fc1-3bd5-4c68-9d61-9cfd69b3cc94,2022-11-24 02:45:40,2022-08-28 12:04:16
8c870726-583a-4b51-a91d-19734417879f,40,"Contact with hot heating appliances, radiators and pipes","Dilation of Left Femoral Vein, Perc Endo Approach",376f885a-f67c-46fd-85d2-41942c6f0792,2022-04-13 16:22:05,2022-07-21 04:11:49
ecaf9570-b669-4a16-8eba-449919824822,55,"Maternal care for damage to fetus from alcohol, fetus 1","Excision of Right Frontal Bone, Percutaneous Approach, Diagn",5ee84ea0-33a7-4988-8380-6a70d58a3956,2022-04-13 11:42:08,2022-05-04 08:00:56
e1cb9345-42ba-47ee-9ab9-3adf4f1d8e55,69,"Pathological fracture in other disease, left radius, sequela","Bypass L Great Saphenous to Low Vein w Autol Art, Open",3efcf33e-e3c2-43c6-bdfd-51e02797d04d,2022-11-13 08:35:42,2022-10-24 13:28:02
8a5305d8-517e-423e-b410-d96d9fd7bb17,17,"Unspecified injury of lung, unspecified, sequela","Drainage of Jejunum, Via Natural or Artificial Opening",7060687e-0395-4cd5-a175-e70bc4c56e75,2022-04-10 07:57:21,2022-06-12 12:38:07
b227a361-ebb4-41e2-bfc8-c71dcd943bfd,4,"Developmental disorder of speech and language, unspecified","Restriction of Hepatic Art with Extralum Dev, Perc Approach",c455fee1-9d12-4561-9b71-63afdf3ea618,2022-12-29 10:26:30,2022-08-27 16:28:25
d05c9821-b3fa-48a8-9929-ab642efa682e,25,Corrosion of third degree of back of right hand,"Division of Sacrum, Percutaneous Endoscopic Approach",0c05bac2-2c6a-4568-a8a9-57e357a2dbb4,2022-07-10 05:24:11,2022-12-11 09:36:48
75ac6915-83fd-4536-9639-4157ed20c396,15,"Unsp traum nondisp spondylolysis of third cervcal vert, sqla","Fluoroscopy of L Pulm Vein using H Osm Contrast, Guidance",bbc485bb-c5c9-4a72-a947-492660b10d87,2022-04-16 04:58:23,2022-10-12 11:02:20
e5f324aa-9bf7-453b-a9e1-4998a01111e9,10,Oth soft tissue disorders related to use/pressure of thigh,"Reattachment of R Thorax Bursa/Lig, Perc Endo Approach",96dd1402-3684-481e-9393-09fca85e2505,2022-12-16 10:29:12,2023-02-23 20:32:51
255f24bc-c890-4c23-86da-eaa87668d844,70,"Complete loss of teeth due to trauma, unspecified class",HDR Brachytherapy of Nasopharynx using Palladium 103,6ccabf4b-fe8d-4aca-b70c-3e29683636dc,2022-06-04 15:56:42,2022-08-09 16:50:20
cee1e245-ab81-48f1-aacc-fca01d5f09b7,50,Nondisp fx of posterior column of unspecified acetabulum,"Control Bleeding in Cranial Cavity, Open Approach",a1b18fc0-a840-4cdb-a98f-0c056fd768e2,2023-02-19 14:38:45,2023-02-08 15:22:16
8ba030af-a6fb-403c-bf49-80f69b0562bf,30,"Subluxation of left acromioclavicular joint, sequela","Excision of Right Testis, Percutaneous Endoscopic Approach",06e043aa-34d4-4a77-a11c-c7f869b7df99,2022-10-07 16:01:53,2022-06-16 01:34:07
63e5b2e5-cf25-47e2-9e98-21f3119f6ac3,38,Unspecified open wound of thyroid gland,"Drainage of Right Ovary, Perc Endo Approach, Diagn",7bed49b2-d8ac-4453-8045-a585eef33d89,2022-09-14 13:03:13,2023-01-29 15:36:02
77439108-0670-4c01-a0c2-bddfea65ae80,48,"Other streptococcal arthritis, unspecified joint",Select Picture Audiometry Assessment,6736ee61-8905-4332-b83f-7a6de2a03355,2022-04-20 11:55:40,2022-07-09 15:19:56
239d2d6b-e934-453d-a9b5-c8e3dfb1972a,80,"Abrasion, left ankle","Irrigation of Indwell Dev using Irrigat, Extern Approach",46243580-5d15-4730-b750-35ffbd24650a,2022-11-10 08:04:05,2022-05-07 18:12:38
457b6c7f-4b8e-47f8-85a1-8e83b05f93c4,6,Arnold-Chiari syndrome with spina bifida and hydrocephalus,"Supplement Spinal Meninges w Nonaut Sub, Perc Endo",d575da97-14af-40d9-b092-c0dc6fc36f7d,2022-12-30 21:32:47,2022-05-02 21:43:31
e5674c9f-b987-4bcc-a68b-54515cbed5f9,1,"Displ oblique fx shaft of l rad, 7thG","Change Other Device in Lymphatic, External Approach",19086e6c-1b72-4251-976b-f9972aab0506,2022-05-18 23:13:04,2023-01-29 09:12:20
2c7063bd-d396-4cc1-9869-511cffa69fbe,27,"Blister (nonthermal), right great toe, sequela","Destruction of Right Hand Artery, Perc Endo Approach",624162c5-a422-4853-971b-e8110ba2a175,2022-07-17 15:22:27,2022-03-29 01:49:02
40ba41a7-1efe-477b-ba40-96bea52beeea,10,"Nondisp oblique fx shaft of l ulna, 7thH",Aural Rehabilitation Status Assessment using AV Equipment,b885cd94-2473-4c36-a2e3-5226f09e168d,2022-12-18 05:06:32,2023-01-20 05:29:35
f367f7e4-a167-42e7-b0ce-bb079f7e5bc5,38,"Open bite of l bk wl of thorax w/o penet thor cavity, init","Drainage of Left Internal Iliac Artery, Open Approach",fde9117c-0769-4de8-aaa7-6c7d4e221d68,2022-09-22 04:10:38,2022-09-04 09:39:35
9215fdf6-2ed6-49bc-8013-5ea26c0fde80,91,"Mix cndct/snrl hear loss,uni,r ear w rstrcd hear cntra side","Excision of Gastric Vein, Open Approach, Diagnostic",c1455fb2-b30f-4a0f-9d0a-28eb871aa145,2022-09-28 19:14:11,2022-07-17 21:14:19
7ed87ed2-6de8-418c-856b-baf251c49621,57,"Crushing injury of right lesser toe(s), subsequent encounter","Supplement Left Hand Tendon with Nonaut Sub, Open Approach",5e29d1d8-57d7-4fd4-892b-961c7af06292,2022-07-28 19:35:25,2022-06-05 06:15:34
0738a356-240b-475b-9e06-56164aa20ba8,44,"Nondisp spiral fx shaft of rad, l arm, 7thK","Insertion of Ext Fix into L Finger Phalanx, Perc Approach",3d740962-a2b1-4efc-bd81-58f9524a5976,2022-03-04 00:19:49,2022-08-26 11:08:31
6fbc97d5-0cfb-45c6-a531-36ed23ea6211,40,"Person outsd hv veh inj pk-up truck, pk-up/van nontraf, subs",Contact Radiation of Pelvic Bones,976a6544-4516-4ebb-a5f0-42194259b82e,2023-02-17 22:01:44,2022-08-27 09:35:32
632fce72-cce1-4b7b-8416-1734de348a3d,43,Puncture wound without foreign body of penis,"Revision of Drainage Device in Fem Perineum, Perc Approach",19103a45-6420-4c6e-bbe6-71d2f36d8a35,2022-03-08 23:00:00,2022-07-14 16:07:20
f3bbc207-d795-4e0f-bb15-f99e716cec15,8,Retained (nonmagnetic) (old) foreign body in vitreous body,"Occlusion R Cephalic Vein w Extralum Dev, Open",86314f71-7ef8-4e6f-a611-25bd3c975013,2022-05-06 18:31:56,2022-11-28 02:52:17
6a2a6151-c0dd-45e9-aa6f-d8345df56e89,8,Anterior soft tissue impingement,"Bypass L Int Iliac Art to Foot Art w Autol Art, Perc Endo",575a3bdd-b014-425f-b22d-1ca10b7f7847,2023-02-25 02:51:44,2022-10-18 22:30:54
6ed73126-54bb-4d0b-953e-128753147165,20,"Displ transverse fx shaft of r tibia, 7thC","Insert Infusion Dev in Inf Vena Cava, Perc Endo",1c635a29-2f7b-45cc-bad3-8a67bb496c30,2022-10-07 03:25:25,2022-11-16 19:19:11
ed4050e5-1cfe-4baa-9d0b-bb75278c1791,18,"Other fracture of shaft of right fibula, sequela",LDR Brachytherapy of Spleen using Palladium 103,3d740962-a2b1-4efc-bd81-58f9524a5976,2023-01-23 12:35:00,2022-10-23 15:09:56
8ee3b7ea-8f1f-4b89-8fea-94520293cfda,90,Burn of third degree of thumb (nail),"Fusion of R Metatarsotars Jt with Nonaut Sub, Perc Approach",c455fee1-9d12-4561-9b71-63afdf3ea618,2022-09-13 04:49:43,2022-10-27 02:30:56
b136bd16-f858-4a8c-9e67-b14296d68880,40,"Intentional self-harm by drown in natural water, subs","Supplement R Knee with Synth Sub, Perc Endo Approach",48177d99-4a64-4d30-9ebd-52ea6ec7e37c,2022-06-04 18:39:03,2023-02-26 19:28:03
2fdb7fd7-96f7-4126-8ce2-de4cdafe5751,28,"Nondisplaced transverse fracture of right patella, sequela","Revision of Drain Dev in Low Tendon, Perc Endo Approach",a2a06bb2-85d5-466b-9a99-4cec8240e472,2022-08-26 21:32:16,2022-07-26 14:22:27
f65895dc-3759-4fd1-a1e8-8bfa2a6988ed,5,"Displaced segmental fracture of shaft of right tibia, init","Replace R Palatine Bone w Synth Sub, Perc Endo",6561d32d-c597-4437-bd23-79a2e58b39d6,2022-09-08 18:23:16,2022-09-28 21:53:34
49e8cb6a-f596-4fe9-9f8d-1197957e6f17,69,"Sensorineural hearing loss, bilateral","Measurement of Intracranial Saturation, Via Opening",14c93884-e8ab-4a6a-a3d2-eca9ef801672,2022-08-14 19:52:03,2022-12-15 01:26:17
c2fecd16-ee7d-45fa-aca1-e5e10c3994ef,97,"Poisoning by caffeine, undetermined","Excision of L Ext Carotid, Perc Endo Approach, Diagn",89188c4a-0a54-4023-8614-43062d112c4b,2022-10-14 07:05:28,2022-10-25 10:17:31
66be3a36-b0ed-4f0d-b9a5-264ffd46cd70,36,"Poisoning by lysergide, intentional self-harm, init encntr","Revision of Synth Sub in R Low Extrem, Extern Approach",ff76f94c-4546-4b88-b638-ca1fd3512008,2022-09-14 20:30:24,2023-01-26 08:21:56
c71db662-02cb-4c6d-98b6-3a153e6758a0,73,"Crushing injury of left elbow, sequela","Removal of Drain Dev from Salivary Gland, Open Approach",37b8d209-3254-4cc0-a413-f3f630334775,2022-03-16 00:27:42,2022-12-09 16:45:32
87bc18fb-ebe3-42b9-af70-b9b7992670c2,15,"Exposure of implanted urethral mesh into urethra, subs","Introduce Liquid Brachy in Cran Cav/Brain, Open",976a6544-4516-4ebb-a5f0-42194259b82e,2022-05-04 01:22:49,2022-07-20 08:57:33
615bc419-393b-41da-93e1-6753acf88d4e,4,"Poisn by oth antacids and anti-gstrc-sec drugs, undet, sqla","Dilate L Fem Art, Bifurc, w Drug-elut Intra, Perc Endo",42d76d9a-3e2f-49ba-997b-5916e27ca923,2023-01-04 07:00:28,2022-12-03 03:50:00
49a01fc9-0aee-44e6-bdbc-79e94de1b00c,45,"Endocrine, nutritional and metabolic diseases comp the puerp",Anthropometric Characteristics Assessment using Oth Equip,0a160e25-eda4-4bd0-8727-cdedfd1ee172,2022-07-25 08:57:34,2022-11-18 19:59:01
18711a42-b93d-46c0-aa7f-ab2f8ef267d5,74,"Underdosing of sulfonamides, sequela","Removal of Autol Sub from Lumsac Jt, Open Approach",314f633d-0443-4cc6-9916-96516697c607,2022-10-04 04:40:37,2022-10-12 11:14:08
f3800299-e3d6-4561-b5a5-47118ddfe481,1,"Pre-existing type 1 diabetes, in pregnancy, first trimester","Extirpate matter from L Up Extrem Lymph, Perc Endo",555e837f-6983-4826-b041-bbeaac52be53,2022-12-14 15:51:27,2022-09-06 14:56:26
039dd9dc-1aa8-4ca0-b083-49446c34dcd9,95,"Disp fx of shaft of 3rd MC bone, r hand, 7thG","Bypass R Fallopian Tube to Uterus w Autol Sub, Perc Endo",b93a1447-a15d-4d3a-b2f0-fabd269cc06d,2022-04-12 20:19:00,2023-01-24 21:04:27
b89ab5c2-408c-409c-897a-995f5d87f10b,67,"Abscess of breast associated with pregnancy, third trimester","Drainage of Common Bile Duct, Open Approach, Diagnostic",4cb915e3-82df-4819-bace-eb1e31d98f00,2022-09-15 08:29:57,2022-12-18 12:26:41
5c69e68b-8d66-4132-8cba-38430cd8bda1,60,"Anterior cord syndrome at T11-T12, init","Division of Left Parietal Bone, Perc Endo Approach",626642b3-148a-43b6-a050-636c9ea02efb,2022-07-30 22:00:14,2022-05-25 20:34:28
524b0cf2-4b85-45c2-b519-09e6d6584c17,45,Open bite of finger without damage to nail,"Revision of Ext Fix in R Metacarpal, Perc Approach",4af1c499-eab9-42b8-ac11-e64863a0acd8,2022-07-26 10:44:12,2022-05-07 20:23:48
9a37a3f6-d0b6-4d9b-b7d5-84c5e42bac56,24,Monoplg low lmb fol oth ntrm intcrn hemor aff l nondom side,"Bypass Trans Colon to Trans Colon w Synth Sub, Open",422fb7d9-48d0-48f2-a46d-62ed621dc6e8,2022-07-21 23:03:22,2022-11-04 01:14:20
9a7fe023-8da8-406e-b2e9-cf3e298240b8,54,"Occupant (driver) of pk-up/van injured in unsp nontraf, init","Replacement of R Low Eyelid with Synth Sub, Extern Approach",fd4c7a11-4c96-46d1-879b-ccfc76bc9b71,2022-12-23 20:51:25,2023-02-27 05:24:05
efbff348-2a52-4349-9839-a4556d007d68,2,"Adverse effect of androgens and anabolic congeners, subs",LDR Brachytherapy of Sinuses using Cesium 137,52f32887-af5b-4bbf-a61f-ee4fb696baa6,2022-05-13 01:11:50,2022-12-25 06:36:11
5f0dafbc-30a2-46c4-a48a-423a287b881d,7,"Displaced transcondylar fracture of unsp humerus, sequela","Supplement Cul-de-sac with Synthetic Substitute, Via Opening",554ee670-a09e-42d2-97b0-016d18f84e0b,2022-08-08 09:10:56,2022-12-31 08:54:36
159cf88a-ea40-46b5-a8e7-95c33a3bcfcf,50,"Burn of third degree of right elbow, subsequent encounter","Reattachment of Left Diaphragm, Open Approach",90c242af-5ba7-40d0-a4c4-85ee998a0f8f,2022-08-04 00:52:21,2022-05-31 08:45:50
dc1fec2a-600e-4d3e-9332-3175452303aa,41,"Foreign body of alimentary tract, part unspecified, sequela","Extirpation of Matter from Occip Jt, Perc Endo Approach",fd826e45-3762-46bd-8853-aeb75ec06133,2022-11-07 19:32:19,2022-08-19 12:57:23
5b6e5538-ad87-4265-8ea5-6f42f804bfdf,93,"Sltr-haris Type IV physl fx upr end humer, unsp arm, 7thD","Fragmentation in Pericardial Cavity, Perc Endo Approach",45517c93-2403-43df-b68b-c6fb2805df71,2022-05-17 07:40:26,2022-09-26 17:50:33
3ea8cddf-aed8-4658-bcbb-e49c6176f5a9,19,"Nodlr scler Hdgkn lymph, nodes of ing region and lower limb",Plain Radiography of Left Humerus,49b7f57a-fbe8-46bc-a7f9-c6705b55b201,2022-07-20 23:37:44,2022-07-08 13:06:52
