id,importe,tipo,descripcion,animal_id,inserted_at,updated_at
be26ecec-2458-4bb7-880d-555aa288d99a,3,"Nondisp fx of med epicondyl of unsp humer, init for opn fx","Insertion of Infusion Device into Fallopian Tube, Endo",575a3bdd-b014-425f-b22d-1ca10b7f7847,2022-07-27 04:31:45,2022-03-14 07:37:02
dce8a599-1a00-4e30-8ad0-1d6d7b291f5c,21,"Poisn by oth prim sys and hematolog agents, undet, sequela","Removal of Nonaut Sub from R Acetabulum, Perc Approach",4e04afe1-416b-482f-addb-cc5f3aa43fce,2023-02-20 23:00:38,2022-09-09 08:00:51
b98970b6-f8bf-4c4b-8fec-e36af60e5df8,58,Encounter for removal of internal fixation device,"Release Perineum Muscle, Percutaneous Endoscopic Approach",9e52139e-80b0-4bde-890d-4bcb661a2364,2022-12-22 16:14:13,2022-12-29 06:18:22
5c684db5-4fb1-480a-bc5f-26b6784745a1,21,"Burn of unsp degree of right toe(s) (nail), subs encntr","Supplement L Com Iliac Vein with Autol Sub, Open Approach",0238e6c4-5cbb-4563-9a39-15fb8070d78a,2022-09-18 03:24:40,2022-06-24 07:03:36
954d8ba6-7b47-4be6-8d11-d1f890374131,17,Dislocation of unspecified internal joint prosthesis,"Removal of Autol Sub from Up Muscle, Perc Endo Approach",acc7e543-9c40-48d7-a101-9c57dd6a11aa,2022-07-23 05:41:24,2022-12-11 23:09:07
15ddd62c-7a83-4918-be36-dc4dd5480bc8,51,Unspecified type of carcinoma in situ of left breast,"Destruction of Right Main Bronchus, Open Approach",0dbf5dce-98cb-4610-8a24-6e22d066bacb,2022-04-10 22:42:29,2023-01-10 02:39:33
ae90bb1b-2fb2-4731-82c5-f91c894c726c,75,Non-pressure chronic ulcer of right calf w necrosis of bone,"Occlusion R Brach Art w Extralum Dev, Perc Endo",0a619a60-5b62-4496-80fb-bb4ea790c5ec,2022-09-01 21:59:19,2022-12-26 15:22:43
5113ceb3-d6b9-43ec-95c9-8ee92838c284,72,"Unsp inj blood vessels at hip and thi lev, unsp leg, init","Insert Infusion Dev in L Metatarsophal Jt, Perc",06045240-05f6-4aab-8898-a6440df49720,2022-11-02 15:19:05,2022-10-15 15:05:35
c7b39431-a519-4463-9e28-ee62e7a7b5cb,25,"Contusion of left elbow, sequela","Extirpation of Matter from L Toe Phalanx Jt, Perc Approach",5e0c97c0-5a73-4d01-b038-0ada0b83fe37,2023-01-04 16:52:07,2022-11-20 13:40:00
5e99d7a6-efa1-4057-9d03-652065bdc8a4,37,"Nondisplaced oblique fracture of shaft of unsp radius, init","Repair Left Conjunctiva, External Approach",9aaf7454-5d5d-4642-a4e8-1fa58f5e3079,2022-06-26 21:11:04,2022-08-18 13:10:36
77c9dd6a-bacd-4fdb-b7ac-0d3931a06632,89,"Benign neoplasm of colon, unspecified","Revise of Infusion Dev in R Metacarpocarp Jt, Open Approach",6ac221e0-07db-408a-b41b-446efcc6ff2d,2022-11-15 08:10:29,2022-06-07 21:01:45
9b35ccad-66ee-4fe1-a520-3669e3b9d6dc,100,"Occup of special agri vehicle injured in traf, sequela","Removal of Autol Sub from L Up Extrem, Extern Approach",b5a1236c-da47-4c4e-8fbd-eb9870df5ef8,2022-06-05 09:12:56,2022-07-24 15:55:47
e298029a-ca76-4f55-841e-32b304d3a0a2,87,"Disp fx of olecran pro w/o intartic extn r ulna, 7thF","Revise of Nonaut Sub in Epididymis/Sperm Cord, Open Approach",8eca2128-815e-488e-81f6-71e6f123a55f,2023-02-15 06:18:32,2022-07-15 06:19:45
de987233-bde4-4516-bbe4-2188b7f87f11,52,"Sicca syndrome, unspecified","Restriction of Innom Art with Intralum Dev, Open Approach",45517c93-2403-43df-b68b-c6fb2805df71,2022-06-03 09:53:15,2022-04-02 20:12:28
5c4ce167-30d1-496c-b6e8-508a9c579021,57,Struck by other nonvenomous reptiles,Plain Radiography of L Verteb Art using L Osm Contrast,2dfcc1e3-a7c4-44c3-82cc-90f9543ded36,2022-04-07 00:04:27,2022-06-01 20:27:47
095e802c-3d31-4798-a31e-addbc31e253d,39,Malignant neoplasm of anus and anal canal,"Removal of Nonaut Sub from Trachea, Perc Endo Approach",30bdcf33-dc04-4a40-9b8d-45838050e5dd,2022-03-15 06:29:46,2022-12-31 08:52:02
4d379dc5-487c-4084-a152-eaf95acc6be6,27,"Maternal care for oth rhesus isoimmun, first trimester","Introduction of Low dose IL-2 into Periph Art, Perc Approach",87386e6a-d3a5-4056-874b-d987434fe73f,2022-08-13 09:37:28,2023-01-16 03:17:43
004ef08f-7541-4cad-84fb-2363a3d3317b,22,"Toxic effect of venom of N & S American snake, undet, init","Alteration of Right Lower Eyelid, External Approach",3f03ec31-a784-41bd-9140-204ec3e2d401,2022-09-28 06:18:03,2022-07-04 17:57:16
20256bcc-ca24-4a97-b432-f9f95c75870b,54,"Disorder of prostate, unspecified","Drainage of Pelvic Subcu/Fascia, Open Approach",d4075e21-e1af-401b-8295-8ba2087db226,2022-06-22 03:15:05,2023-02-12 22:15:33
7dbc8b98-2867-4694-8f00-8ad69ce02b44,11,"Prsn brd/alit a car injured in collision w car, subs","Destruction of Right Abdomen Tendon, Percutaneous Approach",c3a0ae8d-2bc7-42c8-83b0-9cd1c1c98adb,2022-09-22 20:52:07,2022-06-21 22:55:53
c8cdc059-c12e-453e-86f8-c73574de9f94,57,"Adverse effect of antiasthmatics, subsequent encounter","Supplement Left Femoral Artery with Synth Sub, Perc Approach",12ce6b13-9a20-41c6-b463-7d017cd9e191,2022-07-27 01:59:04,2022-10-04 08:45:47
6c751dbd-66ed-4103-8016-20962914fcc0,32,Elev erythro sedim and abnormality of plasma viscosity,"Division of Sternum, Percutaneous Endoscopic Approach",4a391189-56d5-4b94-b8f5-4032405d7bad,2022-11-28 03:26:17,2022-03-29 10:36:03
4e9bad6a-5d25-4c49-b9b5-9221bd435f2a,78,"Oth fx upr end r rad, subs for opn fx type I/2 w routn heal","Resection of Appendix, Open Approach",b784a2bf-7926-4431-822b-cd3c51d8139c,2022-11-10 02:33:39,2022-06-22 08:01:00
61d04e12-4a2a-48b5-9b81-aa7210f74a6c,64,Spasm of sphincter of Oddi,"Extirpation of Matter from Phrenic Nerve, Open Approach",eea03a79-588e-4b0f-b266-b57f75f6cdea,2022-09-05 03:53:29,2022-08-24 18:34:13
a5567b90-5fc0-41a8-8778-8ab3b12b59f4,61,"Unsp injury of unsp blood vess at hip and thi lev, right leg","Occlusion of Left External Iliac Vein, Perc Endo Approach",6ac221e0-07db-408a-b41b-446efcc6ff2d,2022-06-24 18:41:32,2023-02-01 03:05:29
712dd95d-7ba9-4362-afa0-31f938964270,31,Other forms of bartonellosis,"Removal of Ext Fix from L Tarsal, Perc Endo Approach",6d8cd0db-2ec2-4cf7-8281-1db69802e7ca,2022-10-31 11:17:27,2022-10-24 10:14:39
785ba543-b9b1-4649-ba50-42e3a784119b,42,Unsp inj extensor musc/fasc/tend r idx fngr at wrs/hnd lv,"Excision of Left Buttock, Open Approach",c3318608-0954-4694-9471-edc197df5f07,2023-02-26 14:20:22,2022-03-29 23:30:00
e558a84a-efd0-4f7e-9619-5bfe58016611,41,Osseous stenosis of neural canal of cervical region,"Revision of Synth Sub in L Humeral Shaft, Open Approach",d2b8e626-026d-4e9c-ad9f-792561611031,2022-06-23 10:22:55,2022-04-04 10:52:19
02324f3a-428e-4fd8-9f15-b169345472e6,7,Retained glass fragments,"Drainage of Gastric Artery, Open Approach",2e807c4a-e08e-457e-9e17-3a61600c94e9,2022-04-14 14:44:41,2022-08-31 13:34:19
4111557b-7248-4cc1-9330-cc7aec5df9e6,70,"Torus fracture of upper end of left ulna, sequela","Drainage of L Elbow Bursa/Lig with Drain Dev, Open Approach",68fdbd05-85e8-415f-b2ad-052b6186f32a,2022-07-20 11:17:19,2022-09-01 16:39:13
983bdfa6-9fa4-40c6-9525-87f1d63c226c,45,"Osteophyte, elbow","Destruction of Right Tibia, Percutaneous Approach",b217ab10-4fa5-4ea7-abbd-445907dc77ac,2023-02-19 15:09:15,2022-06-16 17:16:14
6d8fed75-b53e-4cc6-840c-c76bedea48e8,70,"Struck by nonvenomous lizards, initial encounter","Occlusion of Azygos Vein, Percutaneous Approach",b49f1c5a-c678-40ca-98ab-6fc4432c22aa,2022-10-09 22:18:06,2022-11-03 08:40:35
df2436ca-6417-4030-b4bb-0a4cf6defb4c,96,"Chronic angle-closure glaucoma, right eye, moderate stage",Planar Nucl Med Imag of Head & Neck using Iodine 123,4b2c45dd-c0a0-462f-965f-fa325b8e2078,2023-01-04 23:52:20,2023-02-27 22:48:14
84ceea4f-ccc1-482d-80df-d7d2417e7950,60,Oth reactions and intoxications d/t drugs administered to NB,"Hepatobiliary System and Pancreas, Inspection",750cfbd6-136f-461c-9a8b-4056af75a5e7,2022-09-23 23:47:16,2022-11-28 15:24:51
cdecab9e-95c5-4f43-ac40-1464fe78add2,28,"Hemiplegia, unspecified affecting right nondominant side","Bypass Abd Aorta to Low Art with Synth Sub, Open Approach",93973fa7-2f80-4f60-9cb1-e23383037141,2022-04-17 12:19:53,2022-05-08 15:57:54
ebc395e7-c849-4a3b-bd1e-4ecdb0ef60cc,87,"Burn of unspecified degree of unspecified foot, init encntr","Destruction of Esophageal Vein, Perc Endo Approach",7aa11b2c-f3c8-4dfc-a943-808fff6c6f96,2022-06-23 22:53:03,2022-08-27 11:49:31
e69c3311-3712-442a-a879-f8713198c93b,19,"Unsp fx second MC bone, left hand, subs for fx w malunion","Dilation of L Ant Tib Art with 3 Drug-elut, Perc Approach",c2edd36d-f5a3-41d9-8636-8af55bf4f011,2022-12-02 00:28:55,2023-01-21 18:02:54
7acd4293-092a-4752-b2de-3e33d6ee7805,41,"Contact with unspecified machinery, sequela","Supplement L Up Arm Subcu/Fascia w Synth Sub, Open",826e7f63-17d1-4a39-ba77-9755b7f42e33,2022-05-27 08:09:14,2022-03-25 08:08:56
e5c07ed6-23e1-49f6-83dc-383af876bd79,90,"Sprain of interphalangeal joint of unsp great toe, subs","Reattachment of Parathyroid Gland, Open Approach",678b720e-6542-42b3-8fa7-ffcfd1b52e6e,2022-11-24 05:28:36,2022-04-28 20:50:43
e79aaf7d-d199-492e-b9fa-c905c54308dd,92,"Poisoning by oth antieplptc and sed-hypntc drugs, self-harm","Excision of Right Buttock, Percutaneous Endoscopic Approach",40e8b74e-1302-4294-916c-0cbf232aad47,2022-09-29 21:24:33,2022-07-25 22:15:26
3578a647-f2bb-4f03-a592-e45cd5dd0044,4,"Labyrinthine dysfunction, left ear","Restriction of Sigmoid Colon with Intraluminal Device, Endo",9cac76b1-8094-4432-896b-b8f08d6f2eb6,2022-08-14 15:20:27,2023-01-14 01:14:02
1c1f4f05-f820-4b69-bd51-17d70f6dc798,56,"Burn of third degree of left knee, sequela","Excision of Right Fallopian Tube, Percutaneous Approach",e87894d1-7f8c-4f72-b6e9-f257253451ca,2022-09-06 22:18:32,2022-08-10 08:26:00
8993d786-7740-4b40-941b-8f39544e8e8b,36,"Fetomaternal placental transfuse syndrome, second trimester","Transfer L Low Leg Muscle with Skin, Subcu, Open Approach",082ae127-5a6e-446b-a0f3-6aacf800d19d,2022-03-23 09:11:22,2022-09-28 16:44:52
9491a207-c764-4ac0-93fb-43c98535c9bb,64,"Constant exophthalmos, left eye","Revision of Int Fix in L Clavicle, Extern Approach",d0fc03b2-abf9-4c9e-af4b-081c5f6a835c,2022-06-13 18:55:15,2023-02-19 14:28:08
426963b8-566d-4140-b6bf-e525afe4d595,27,Complete traumatic amp at level betw unsp hip and knee,"Excision of Right Internal Carotid Artery, Perc Approach",14f4da79-f995-404a-ada9-3af1ba04ffc7,2022-03-29 19:56:00,2022-05-02 06:05:18
416e87f3-b449-43a0-b323-950e3ee74f4e,74,"Quadriplegia, C1-C4 incomplete","Drainage of Left Thyroid Artery, Perc Endo Approach",cf17fb24-808c-4855-bc61-6275a77dc7c3,2022-04-18 16:16:51,2022-12-25 17:51:45
e7e6d190-015f-4506-953d-056be7b064b3,83,Carrier of other specified bacterial diseases,"Replacement of L Palatine Bone with Autol Sub, Perc Approach",521eadb3-0e4f-4c30-bd09-458b425d9048,2022-07-28 06:02:14,2022-08-15 22:21:50
500d7475-5463-4cd2-9885-eb1a7cccf804,39,Acute apical periodontitis of pulpal origin,"Fusion of Left Tarsal Joint with Synth Sub, Open Approach",6dc6018b-c250-4aa2-a4de-3255c24d94bc,2022-08-20 01:55:53,2022-04-28 02:56:29
e91a95f2-d21f-4ce1-9c84-1e58ff5409cc,32,"Subluxation of MTP joint of unsp lesser toe(s), init","Destruction of Right Acromioclavicular Joint, Open Approach",29cec3ad-7ea3-4f82-b238-a554221f78d6,2022-05-23 04:50:53,2022-09-06 16:23:17
4ff0c890-f62f-409f-bfa3-d748dee47f88,64,"Tear of articular cartilage of knee, current","Resection of Left Knee Joint, Open Approach",3e01c66e-a603-4b1d-93a7-f574a52e6ff1,2022-04-02 13:07:11,2022-04-24 04:07:00
7da066e2-0b01-404e-8995-93eec350520e,60,"Other cervical disc displacement,  high cervical region","Drainage of Int Mamm, R Lymph with Drain Dev, Open Approach",45908d88-f429-40b2-b086-b0c022f7f98d,2023-02-27 08:57:41,2022-06-01 01:10:46
9cda018a-db7f-4238-8572-22d8889348c2,63,Postproc hemorrhage of a GU sys org following a procedure,"Bypass R Com Iliac Art to R Renal A, Perc Endo Approach",bd19f0cc-71ea-490d-af62-83b381989aeb,2022-12-07 23:29:58,2022-07-17 15:22:01
3e6b0939-de21-495d-a779-83924d5c5e90,66,"Displ spiral fx shaft of unsp femr, 7thQ","Dilation of Mid Esophag with Intralum Dev, Open Approach",c12c3acd-88af-4c37-83f5-469a8496f35a,2022-12-30 01:33:58,2022-10-05 15:29:05
412db3f7-d492-4cf0-8984-919aff6fd057,82,Bathroom in nursing home as place,"Fluoroscopy of Bilateral Pulmonary Veins, Guidance",5e482d5b-eb56-4559-b60c-e6f9398a531b,2022-05-18 12:22:19,2022-05-01 13:52:30
6d46f8cc-4154-4f84-94ec-528807ebdd66,60,"Combined forms of age-related cataract, unspecified eye","Reposition Right Metacarpal, Perc Endo Approach",b49f1c5a-c678-40ca-98ab-6fc4432c22aa,2022-07-03 10:42:10,2022-10-16 19:34:59
c2013382-8589-4206-991b-eea90c9e73f9,13,"War operations involving unsp dest arcrft, milt, init","Reposition Cervical Vertebra, Open Approach",1097504a-3c84-4d17-9b02-84ec813c30e7,2022-12-14 14:18:33,2022-12-17 05:50:10
74dfc169-557a-4de6-99f1-141e3a80815b,72,"Prsn brd/alit pedl cyc inj in clsn w rail trn/veh, sequela",Computerized Tomography (CT Scan) of Right Pulmonary Vein,9cac76b1-8094-4432-896b-b8f08d6f2eb6,2022-07-16 09:33:22,2023-02-11 05:07:36
9e5f335c-3bc0-492f-ac36-ce36c6f56254,26,"Complete traumatic MCP amputation of r little finger, init","Bypass Right Ureter to Colocutaneous, Perc Endo Approach",1adf4254-0205-4b4a-9859-aede57614942,2022-12-22 21:02:59,2022-10-14 14:21:26
337dfd93-35c7-48a2-a950-4e0105a0b0c6,100,"False labor, unspecified","Removal of Synth Sub from R Tarsal Jt, Open Approach",3ea89c39-6dc2-441b-8c50-0f87ec1caa87,2022-11-25 16:40:53,2022-08-13 14:18:38
67bc9136-e447-4e57-a1c1-8c7db3131d75,76,"Open bite of unsp finger without damage to nail, sequela","Bypass Bilateral Ureters to Cutaneous, Perc Endo Approach",c2af02fb-1337-4c46-a102-65c03b23b4ec,2022-06-02 22:48:04,2022-08-07 11:47:55
2b6b0d6b-09e3-43b3-891c-f108bf09a2c8,94,"Maternal care for anti-D antibodies, second tri, fetus 1","Dilate L Foot Art, Bifurc, w 4 Drug-elut, Open",eec7811e-4abd-483a-b40b-08ff87105a19,2022-11-10 12:35:11,2022-04-12 07:22:38
6ef389dd-1c47-4a6f-a15a-e658a6f7bfdc,98,"Fall on or from other playground equipment, subs encntr","Introduce of Electrol/Water Bal into Mouth/Phar, Via Opening",145addb0-2465-4e10-bcf8-71a8a52bb2bb,2022-08-14 01:11:38,2022-03-25 22:19:23
ae331f71-9908-4bad-b4ee-de0f7ba5d27c,10,Machinery accident on board passenger ship,"Bypass Cecum to Cutaneous with Autol Sub, Perc Endo Approach",9caff9a4-5aa9-4db9-9a2d-d636549ac51d,2022-08-30 07:35:19,2022-12-22 01:26:25
3dc5c33b-dc1d-477d-a518-a6fa2453b888,17,Malignant neoplasm of unspecified optic nerve,"Drainage of T-lum Jt, Perc Endo Approach, Diagn",752d7315-667d-45d8-9e67-33028c138157,2022-10-02 06:08:24,2022-06-25 20:14:14
89d4c903-84ef-4656-88d7-d9d1ce894387,54,Traumatic amputation at shoulder joint,"Excision of Right Shoulder Muscle, Perc Approach, Diagn",9addd0d8-15bd-4328-b8a7-1809682c0d40,2022-10-11 07:02:31,2022-04-05 09:37:20
0f7e7abd-1354-4623-ac8f-93639e1d99f2,2,"Burn of left eye and adnexa, part unspecified","Replace of R Glenoid Cav with Autol Sub, Perc Endo Approach",aac7e023-c09f-4a73-85aa-4bf1ecae0233,2022-12-19 00:20:10,2022-03-20 23:08:15
a2b14f6e-fce6-4b84-b1c9-e89795d0a8f5,7,"Strain of muscle, fascia and tendon of left hip, init encntr","Removal of Autol Sub from L Radius, Open Approach",139a2d21-132b-44cc-995a-973e72233bbf,2023-02-21 13:28:58,2022-09-21 15:54:29
a020f524-291f-4967-a763-64be0ad2c277,44,"Contus/lac/hem crblm w LOC of 1-5 hrs 59 min, sequela","Extirpation of Matter from Left Metacarpal, Open Approach",8b5bb375-ffe9-47b2-a7bd-4e85a5789026,2022-05-20 12:42:18,2022-06-24 17:45:25
798c3600-b60c-4e41-a9ca-72dda97b7dc0,35,"Unsp fx the lower end unsp rad, init for opn fx type 3A/B/C",Immobilization of Right Hand using Brace,d0a37292-dfec-4e68-b9ee-6b86f7d68be1,2022-04-11 04:27:33,2022-08-02 06:05:02
ff47b3cf-e560-4007-bb18-a9cbdcd8036c,76,"Lacerat extn musc/fasc/tend r little fngr at forarm lv, init","Extirpation of Matter from L Up Extrem Lymph, Open Approach",b7a88245-6584-4696-bca9-766d1c65d3d3,2023-01-22 12:03:49,2022-04-13 08:29:54
47eb81ff-2830-4b99-9f47-6feff4ea4f8e,9,"Abrasion, unspecified hip, subsequent encounter","Restrict of R Ant Tib Art with Intralum Dev, Perc Approach",c2492813-2237-448a-be54-cb404ff9f415,2022-11-19 23:11:53,2022-12-11 09:50:29
2e74fab6-e9ca-4b59-8d23-04c1dcd80b00,53,"Allergy, unspecified, sequela","Repair Middle Esophagus, Percutaneous Approach",37a0cf9a-f562-4cd8-bae8-063a52c98531,2022-06-15 15:44:12,2022-06-13 17:12:10
ef034aa8-9448-40f6-8bde-ca6075cbb757,88,"Mtrcy passenger injured in clsn w pedl cyc in traf, sequela","Occlusion Mid Esophag w Extralum Dev, Perc Endo",ef6ca325-1ad2-4c08-afad-2f377ed9640e,2023-02-22 15:48:09,2023-01-05 05:11:36
cb68cdb2-249e-4f4a-8357-48d97a60fedd,9,"Rheumatoid nodule, hand","Occlusion Mid Esophag w Intralum Dev, Perc Endo",3ee2e38c-1a83-48b2-9525-5a2a7e687a84,2022-06-02 22:52:52,2022-11-09 00:55:58
964a2ab0-0d66-490d-b067-506836df158d,14,"Oth fx shaft of unsp fibula, init for opn fx type I/2","Revision of Drain Dev in L Sacroiliac Jt, Extern Approach",16b079cd-0eb6-422f-b4b2-7c84c45a5153,2023-02-02 06:24:38,2023-02-04 11:32:46
80d62930-0c34-4177-9f62-5dea2aec2bd3,11,"Gestational diabetes in the puerperium, unsp control","Dilation of Uterus, Percutaneous Endoscopic Approach",4ae66f99-2d0a-429c-a1c7-53beb81fd979,2023-01-18 17:40:10,2022-03-03 12:12:43
7d3c98e9-59e0-46b7-97b1-22b2bdad6f95,54,Unspecified open wound of scrotum and testes,"Bypass Thor Aorta Asc to Subclav, Perc Endo Approach",bdfeb5a1-08be-43b2-8d9a-c72b9df0abe8,2023-02-11 19:43:13,2022-05-07 03:16:12
be9c376f-bbfa-4612-924a-5639e4146ff7,37,"Oth osteopor w crnt path fx, verteb, 7thD","Upper Bones, Insertion",5557a7ba-2316-40e1-a865-d64cca52a8ee,2022-05-23 09:00:28,2022-10-08 04:32:36
41c64393-57ce-4b1d-9476-8c502d4e0e22,26,Congenital lactase deficiency,"Transfuse of Nonaut Globulin into Periph Art, Open Approach",9b08e59d-57c3-49a1-a635-923b74ebd9c2,2022-11-16 10:42:26,2022-10-03 05:59:21
9e5f1e84-577c-4f12-a2bd-bf9cdab2d6bc,10,"Laceration of plantar artery of unsp foot, subs encntr","Drainage of Splenic Artery, Percutaneous Approach",6be70906-295a-41ac-857c-20d2a7d2ed02,2022-07-11 21:12:26,2022-08-04 05:26:20
f58a6dc7-06cc-4e8c-a39e-0f8272d7198e,85,"Unsp injury of intercostl blood vessels, right side, sequela","Restrict of L Kidney Pelvis with Intralum Dev, Perc Approach",ae176284-6c00-4f29-84cb-cb902211283c,2022-07-04 11:03:01,2022-05-28 04:48:08
b063316c-6aeb-4feb-a7da-e261a8bdaabd,14,Other sprain of unspecified hip,"Dilate L Basilic Vein w Intralum Dev, Perc Endo",9fa26ab6-cbe0-41c9-ab57-2f9674cdaadf,2022-12-16 15:46:53,2022-07-22 13:57:39
4b4a9581-c70f-4815-a07b-e4c637b98099,59,Lac w fb of back wall of thorax w penet thoracic cavity,"Bypass Right Hepatic Duct to R Hep Duc, Open Approach",07982764-13ec-41ca-ab03-ec19f6e7d544,2023-02-14 21:28:22,2022-11-09 12:00:57
53bcc051-4729-4412-89e1-2a1345d9a3a1,73,"Lac w/o fb of unsp external genital organs, male, sequela","Dilate of R Ext Carotid with 4+ Intralum Dev, Perc Approach",df75db7d-e60b-4694-b8c1-e2fbcd07cb00,2022-12-19 15:54:32,2022-12-16 15:00:35
aeb844c1-2118-48fe-8e50-b58e48af425e,49,"Disp fx of proximal phalanx of unsp great toe, init","Supplement Hymen with Nonaut Sub, Perc Endo Approach",ab3504c3-8153-4b88-9d54-227426549cb2,2022-07-27 02:46:43,2022-10-03 07:13:45
3e32e6a8-01ba-42bb-8f4d-12ee9fbd8588,4,"Toxic effect of other tobacco and nicotine, assault","Replacement of R Hip Jt with Metal, Cement, Open Approach",926e7e9e-5e75-4982-9ee3-5fcab23536b9,2023-01-27 03:24:11,2022-07-14 20:13:00
6aaf5118-5038-40ae-a099-6b8878bc591f,85,"Assault by shotgun, sequela","Removal of Nonaut Sub from Spinal Cord, Perc Approach",89a33ea6-0597-4114-a1f0-6dcd9afc4fa0,2022-06-04 12:39:26,2023-01-10 10:04:39
3c587c3e-aca2-470a-ab19-58a77117ee8e,50,"Corrosion of first degree of right thumb (nail), subs encntr","Replacement of Nasal Turbinate with Nonaut Sub, Via Opening",11789c4c-cb30-4457-9f82-382400926972,2023-01-03 00:48:54,2022-05-19 16:20:16
7db23005-c265-402e-8934-16c34a346141,63,"Diabetes with mild nonp rtnop with macular edema, unsp","Excision of Left Pleura, Percutaneous Approach",c4c293a6-6897-4024-862e-54424f888eb7,2022-12-26 19:47:54,2022-05-01 15:20:34
619cbe4b-7592-47f0-a81f-44deaf4d3419,32,"Discitis, unspecified, sacral and sacrococcygeal region","Excision of Left Upper Femur, Perc Endo Approach",3f077de9-14fc-4102-b5be-2c2f76d6d5cb,2023-01-05 12:47:06,2022-07-13 06:30:11
54449d11-db0a-481a-8d90-3974cdfe1f91,18,"Contact with hot water in bath or tub, sequela",Osteopathic Treatment of Thoracic Region using Lymph Pump,3654646d-f53a-451e-a543-86f340cab1e8,2022-03-07 09:06:48,2022-10-15 11:59:53
705ee12a-31d9-446d-9d50-41e81b4b5636,69,"Oth comp of fb acc left in body following punctr/cath, init","Revision of Synth Sub in Up Muscle, Perc Endo Approach",9cac76b1-8094-4432-896b-b8f08d6f2eb6,2022-09-13 11:03:20,2022-06-11 20:21:09
30041466-0230-4249-a9ac-3f32778621f0,94,"Displ osteochon fx left patella, init for opn fx type I/2",Beam Radiation of Hemibody using Photons 1 - 10 MeV,658dbbd0-f07a-4a71-ba2a-c4b4c77e3fa6,2022-11-12 08:42:18,2023-01-21 00:16:14
cf6c6822-58c3-4141-ae5a-5f95e340ba76,2,"Nondisp fx of medial cuneiform of unspecified foot, sequela","Replace of L Hip Tendon with Autol Sub, Perc Endo Approach",b49f1c5a-c678-40ca-98ab-6fc4432c22aa,2022-05-10 00:47:49,2022-07-24 22:02:41
4e3cc1f7-066d-4f29-94e4-14061395f573,6,"Oth fracture of right lower leg, init for opn fx type I/2","Removal of Int Fix from L Toe Phalanx Jt, Perc Endo Approach",4e14d74b-9eff-4c10-b9a3-0568bef44e4b,2023-01-19 17:57:20,2023-01-24 13:46:59
9f9da242-0b0d-4e0a-8600-41b8cfdabaf7,2,"Fx unsp part of neck of r femur, subs for clos fx w nonunion",Exercise Treatment of Circ Up Back/UE using Mech Equipment,3f8e2ca7-ad90-4a4a-8625-a43a5b9707e8,2023-02-09 20:29:01,2022-07-07 20:02:42
e2906e35-feca-433f-b0ef-064bbf65f273,19,"Oth fracture of right talus, subs for fx w malunion","Supplement Left Humeral Head with Nonaut Sub, Perc Approach",447cbcc6-d0bf-452b-b8b7-4b822320f5fe,2022-09-22 10:39:21,2023-02-04 01:58:55
ed6dbad5-c470-4190-8cc8-1b235cb243b7,65,"Burn due to localized fire on board sailboat, sequela",Irrigation of Skin and Mucous Membranes using Irrigat,f6c81b6e-36f9-4ae5-b497-4c865cb60bb4,2022-07-25 19:56:37,2022-07-15 18:37:35
d9d44a8e-ad66-46f8-a563-93f84c4c9e63,56,"Poisoning by emetics, intentional self-harm, sequela","Repair Right Inguinal Lymphatic, Open Approach",40d3a295-95a6-477c-a6f5-85b2071ff402,2022-09-23 03:34:32,2023-02-17 04:24:41
e430aa91-4908-4b85-9181-19f87a27d2ae,36,"Unsp injury of axillary artery, unsp side, init encntr","Supplement Right Rib with Synth Sub, Perc Approach",32fa013d-5dcc-4082-86a6-f1385a0a5019,2022-10-21 08:57:26,2022-12-06 18:55:41
8fa42924-9a7a-42fa-883a-c32005e65f92,18,"Strain of extensor musc/fasc/tend thmb at wrs/hnd lv, subs","Drainage of R Post Tib Art, Perc Endo Approach",4ae66f99-2d0a-429c-a1c7-53beb81fd979,2022-03-18 13:05:55,2023-02-10 15:22:45
6a2f7a37-ef36-4553-8c7e-27203170a3f7,27,Strain of flexor musc/fasc/tend right thumb at forearm level,"Bypass Sigmoid Colon to Cutaneous, Endo",41f4c4c6-5fa3-4b6f-8b6f-5f1f2f8b5829,2022-07-15 06:09:00,2023-01-20 21:20:41
a18f728c-8464-4982-9988-8cdc2c2030c3,82,"Corrosion of unsp degree of back of unsp hand, init encntr","Restrict of R Thyroid Art with Extralum Dev, Open Approach",1c635a29-2f7b-45cc-bad3-8a67bb496c30,2022-09-08 17:16:26,2022-09-05 17:29:17
f30279f1-38e4-4d26-b30f-1b71865564b4,23,Contus/lac/hem crblm w LOC of 6 hours to 24 hours,"Alteration of Left Knee Region with Autol Sub, Open Approach",314f633d-0443-4cc6-9916-96516697c607,2023-01-26 09:13:36,2023-01-12 02:10:14
c82e5d88-2621-49e3-886c-dc58a9a61dc7,1,"Nondisp oblique fx shaft of humer, r arm, 7thD","Supplement Left Trunk Tendon with Synth Sub, Open Approach",40d3a295-95a6-477c-a6f5-85b2071ff402,2022-12-04 16:02:27,2022-12-19 16:45:13
644b7de5-f5b3-46f8-bf03-7c8efc4e40a0,7,Direct infect of joint in infec/parastc dis classd elswhr,"Extirpation of Matter from Left Tarsal, Perc Endo Approach",9d7b618b-8e29-4f24-b81e-4f3085ec0629,2023-01-14 21:03:43,2022-05-29 11:30:11
f3d1b368-110f-41e6-978f-44dcabb0a67b,1,"Driver injured in collision w oth mv in traf, sequela","Replace Papillary Muscle w Nonaut Sub, Perc Endo",8b5bb375-ffe9-47b2-a7bd-4e85a5789026,2022-07-11 16:40:22,2023-02-18 03:20:08
fb2f9e8a-8acc-4923-bca7-d13b98bf53ab,52,"Oth osteopor w crnt path fx, l humer, subs for fx w nonunion","Remove Autol Sub from R Metacarpocarp Jt, Perc Endo",9b290b0e-7045-4f8e-9579-d78423c59f14,2022-04-02 20:13:11,2022-04-27 20:55:31
5624cdc4-c300-46ca-8de1-4e834a3d95ff,24,"Diseases of the circ sys comp pregnancy, unsp trimester","Removal of Drainage Device from Mouth/Throat, Perc Approach",0dbf5dce-98cb-4610-8a24-6e22d066bacb,2022-06-19 23:56:58,2023-02-17 08:56:22
1cddeec8-0b42-405d-bd22-cc91d6d2022f,83,"Strain musc/tend ant grp at low leg level, left leg, subs","Fusion T-lum Jt w Autol Sub, Post Appr A Col, Open",52f32887-af5b-4bbf-a61f-ee4fb696baa6,2022-09-01 17:10:57,2022-04-30 23:35:40
7cf062c8-4111-46c4-bc60-447896146823,86,"Ped on sktbrd injured in clsn w nonmtr vehicle, unsp, init","Insertion of Infusion Device into Cranial Nrv, Open Approach",60a2171b-9ca3-42f3-8b7f-7f746ed84e2c,2022-07-26 10:09:37,2022-06-21 20:57:53
ddce3606-8730-42c1-b36a-196a73dea2df,86,Sparganosis,"Destruction of Aortic Body, Percutaneous Approach",19efcc7e-546b-460e-9790-1d949aae6c8d,2022-11-07 11:45:16,2023-01-19 14:58:14
e9f2b373-48fc-45e7-9f1f-504696fa78f2,88,Crohn's disease of large intestine without complications,"Drainage of Upper Vein, Open Approach, Diagnostic",83cd48a1-8ecb-4759-b7c8-1ba7c3c239ab,2022-06-26 10:48:02,2023-01-01 11:48:06
755890f8-943f-40ea-9322-0a8e70557545,19,"Familial chondrocalcinosis, knee","Occlusion R Kidney Pelvis w Extralum Dev, Open",efe8f7fd-e426-4458-ad9e-bce2313077f4,2022-10-19 00:42:29,2022-03-19 23:32:11
25cb559e-a4e1-4cf4-a4c3-e211688be833,98,Complete traumatic MCP amputation of left little finger,"Inspection of Right Knee Region, Open Approach",49db5c40-9a62-494b-a83c-688c51c22214,2022-03-21 06:51:48,2023-02-08 23:32:58
